wikidata	wikipedia	film	abstract	date	sitelinks	director	genre
http://www.wikidata.org/entity/Q166262	https://en.wikipedia.org/wiki/Batman_Begins	Batman Begins	Batman Begins is a 2005 superhero film directed by Christopher Nolan and written by Nolan and David S. Goyer. Based on the DC Comics character Batman, it stars Christian Bale, Michael Caine, Liam Neeson, Katie Holmes, Gary Oldman, Cillian Murphy, Tom Wilkinson, Rutger Hauer, Ken Watanabe, and Morgan Freeman. The film reboots the Batman film series, telling the origin story of Bruce Wayne from the death of his parents to his journey to become Batman and his fight to stop Ras al Ghul and the Scarecrow from plunging Gotham City into chaos. @ Following the poor reception of Batman Forever and Batman & Robin, a series of unsuccessful attempts were made to resurrect Batman on the big screen which put the Batman film series on hold for nearly eight years. Then, in early 2003, Nolan and Goyer began work on Batman Begins. Aiming for a darker, more realistic tone compared to the previous films, a primary goal for their vision was to engage the audiences emotional investment in both the Batman and Bruce Wayne identities of the lead character. The film, which was principally shot in the United Kingdom, Iceland and Chicago, relied heavily on traditional stunts and miniature effects, with computer-generated imagery being used in a minimal capacity compared to other action films. Comic book storylines such as The Man Who Falls, Year One and The Long Halloween served as inspiration. @ Batman Begins opened on June 15, 2005, in the United States in 3,858 theaters. It grossed over $48 million in its opening weekend in North America, eventually grossing over $373 million worldwide. The film was met with highly positive reviews, with critics praising the tone, Bales performance, action sequences, score, direction, and the emotional weight compared to previous Batman films. Batman Begins was nominated for the Academy Award for Best Cinematography, and has often been cited as one of the most influential films of the 2000s. It was followed by The Dark Knight and The Dark Knight Rises, with the three films constituting The Dark Knight Trilogy.	2005-06-15	75	Christopher Nolan	action film#crime film#crime thriller#drama (film and television)#neo-noir#superhero film
http://www.wikidata.org/entity/Q24815	https://en.wikipedia.org/wiki/Citizen_Kane	Citizen Kane	Citizen Kane is a 1941 American drama film by Orson Welles, its producer, co-screenwriter, director and star. The picture was Welless first feature film. Considered by many critics, filmmakers, and fans to be the greatest film ever made, Citizen Kane was voted as such in five consecutive British Film Institute Sight & Sound polls of critics, and it topped the American Film Institutes 100 Years ... 100 Movies list in 1998, as well as its 2007 update. Nominated for Academy Awards in nine categories, it won an Academy Award for Best Writing by Herman J. Mankiewicz and Welles. Citizen Kane is particularly praised for Gregg Tolands cinematography, Robert Wises editing, Bernard Herrmanns music, and its narrative structure, all of which have been considered innovative and precedent-setting. @ The quasi-biographical film examines the life and legacy of Charles Foster Kane, played by Welles, a composite character based in part upon American media barons William Randolph Hearst and Joseph Pulitzer, Chicago tycoons Samuel Insull and Harold McCormick, as well as aspects of the screenwriters own lives. Upon its release, Hearst prohibited mention of the film in any of his newspapers. @ After the Broadway successes of Welless Mercury Theatre and the controversial 1938 radio broadcast The War of the Worlds on The Mercury Theatre on the Air, Welles was courted by Hollywood. He signed a contract with RKO Pictures in 1939. Although it was unusual for an untried director, he was given the freedom to develop his own story, to use his own cast and crew, and to have final cut privilege. Following two abortive attempts to get a project off the ground, he wrote the screenplay for Citizen Kane, collaborating on the effort with Herman J. Mankiewicz. Principal photography took place in 1940 and the film received its American release in 1941. @ While a critical success, Citizen Kane failed to recoup its costs at the box office. The film faded from view after its release, but was subsequently returned to the publics attention when it was praised by such French critics as André Bazin and given an American revival in 1956. The film was released on Blu-ray on September 13, 2011, for a special 70th-anniversary edition. Citizen Kane was selected by the Library of Congress as an inductee of the 1989 inaugural group of 25 films for preservation in the United States National Film Registry for being culturally, historically, or aesthetically significant.	1941-05-01	74	Orson Welles	biographical film#drama (film and television)#fiction film#flashback film
http://www.wikidata.org/entity/Q106316	https://en.wikipedia.org/wiki/Dead_Poets_Society	Dead Poets Society	Dead Poets Society is a 1989 American teen drama film written by Tom Schulman, directed by Peter Weir, and starring Robin Williams. Set in 1959 at the fictional elite conservative Vermont boarding school Welton Academy, it tells the story of an English teacher who inspires his students through his teaching of poetry. @ The film was a commercial success and received numerous accolades, including Academy Award nominations for Best Director, Best Picture, and Best Actor for Robin Williams. The film won the BAFTA Award for Best Film, the César Award for Best Foreign Film and the David di Donatello Award for Best Foreign Film. Schulman received an Academy Award for Best Original Screenplay for his work.	1989-06-02	74	Peter Weir	coming-of-age story#drama (film and television)#teen film
http://www.wikidata.org/entity/Q153723	https://en.wikipedia.org/wiki/Inglourious_Basterds	Inglourious Basterds	Inglourious Basterds is a 2009 war film written and directed by Quentin Tarantino and starring Brad Pitt, Christoph Waltz, Michael Fassbender, Eli Roth, Diane Kruger, Daniel Brühl, Til Schweiger and Mélanie Laurent. The film tells an alternate history story of two plots to assassinate Nazi Germanys leadership, one planned by Shosanna Dreyfus, a young French Jewish cinema proprietor, and the other by a team of Jewish American soldiers led by First Lieutenant Aldo Raine. Christoph Waltz co-stars as Hans Landa, an SS colonel who is tracking down Raines group and is connected to Shosannas past. The title was inspired by Italian director Enzo G. Castellaris macaroni combat film The Inglorious Bastards, though Tarantinos film is not a remake of it. @ Tarantino wrote the script in 1998, but struggled with the ending and chose instead to direct the two-part film Kill Bill. After directing Death Proof in 2007, Tarantino returned to work on Inglourious Basterds. A co-production of the United States and Germany, the film began principal photography in October 2008 and was filmed in Germany and France with a $70million production budget. It premiered on May 20, 2009, at the 62nd Cannes Film Festival, and received a wide release in theaters in the United States and Europe in August 2009 by The Weinstein Company and Universal Pictures. @ Inglourious Basterds grossed over $321million in theaters worldwide, making it Tarantinos highest-grossing film to that point, until it was surpassed in box office by Django Unchained and Once Upon a Time in Hollywood. The film received widespread acclaim and multiple awards and nominations, among them eight Academy Award nominations. For his role as Landa, Waltz won the Cannes Film Festivals Best Actor Award, as well as the BAFTA, Screen Actors Guild, Critics Choice, Golden Globe, and Academy Award for Best Supporting Actor.	2009-05-20	74	Quentin Tarantino	adventure film#alternate history film#drama (film and television)#parody film#war film
http://www.wikidata.org/entity/Q165817	https://en.wikipedia.org/wiki/Saving_Private_Ryan	Saving Private Ryan	Saving Private Ryan is a 1998 American epic war film directed by Steven Spielberg and written by Robert Rodat. Set during the Invasion of Normandy in World War II, the film is known for its graphic portrayal of war and for the intensity of its second scene of 24 minutes, a depiction of the Omaha Beach assault during the Normandy landings. The film follows United States Army Rangers Captain John H. Miller and his squad as they search for a paratrooper, Private First Class James Francis Ryan, the last surviving brother of a family of four, with his three other brothers having been killed in action. The film was a co-production between DreamWorks Pictures, Paramount Pictures, Amblin Entertainment, and Mutual Film Company, with DreamWorks distributing the film in North America while Paramount released the film internationally. @ In 1996, producer Mark Gordon pitched Rodats idea, which was inspired by the Niland brothers, to Paramount, which eventually began development on the project. Spielberg, who at the time was forming DreamWorks, came on board to direct the project, and Hanks joined the cast. After the cast went through training supervised by Marine veteran Dale Dye, the films principal photography started in June 1997 and lasted two months. The films D-Day scenes were shot in Ballinesker Beach, Curracloe Strand, Ballinesker, just east of Curracloe, County Wexford, Ireland and used members of the Irish Army as infantry for the D-Day landing. @ Released on July 24, 1998, Saving Private Ryan received acclaim from critics and audiences for its performances, realism, cinematography, score, screenplay, and Spielbergs direction, and was placed on many film critics 1998 top ten lists. It was also a box office success, becoming the highest-grossing film of 1998 in the United States with $216.8 million domestically and the second-highest-grossing film of 1998 worldwide with $481.8 million worldwide. Additionally, it grossed $44 million from its release on home video in May 1999. The film won several accolades, including Best Picture and Director at the Golden Globes, Producers Guild of America, Directors Guild of America, and Critics Choice Awards. The film was nominated for eleven Academy Awards at the 71st Academy Awards, where it won five: Best Director, Best Film Editing, Best Cinematography, Best Sound, and Best Sound Effects Editing, though it lost the Academy Award for Best Picture to Shakespeare in Love in a controversial Oscars upset. @ Since its release, Saving Private Ryan has been considered one of the greatest films of all time and has been lauded as influential on the war film genre. It is credited for renewing interest in World War II media. In 2007, the American Film Institute ranked Saving Private Ryan as the 71st-greatest American movie in AFIs 100 Years...100 Movies and in 2014, the film was selected for preservation in the National Film Registry by the Library of Congress as culturally, historically, or aesthetically significant.	1998-07-24	74	Steven Spielberg	action film#drama (film and television)#war film
http://www.wikidata.org/entity/Q181069	https://en.wikipedia.org/wiki/Star_Wars:_Episode_II_%E2%80%93_Attack_of_the_Clones	Star Wars: Episode II – Attack of the Clones	Star Wars: Episode II – Attack of the Clones is a 2002 American epic space-opera film directed by George Lucas and written by Lucas and Jonathan Hales. It is the second installment of the Star Wars prequel trilogy, the fifth Star Wars film to be produced, and the second film in the Skywalker saga. It stars Ewan McGregor, Natalie Portman, Hayden Christensen, Ian McDiarmid, Samuel L. Jackson, Christopher Lee, Anthony Daniels, Kenny Baker, and Frank Oz. Set ten years after the events in The Phantom Menace, the plot sees the galaxy on the brink of civil war, with thousands of planetary systems threatening to secede from the Galactic Republic and join the Confederacy of Independent Systems, led by the former Jedi-turned-Sith Lord Count Dooku. After Senator Padmé Amidala evades an assassination attempt, Jedi Apprentice Anakin Skywalker becomes her protector and develops a secret relationship with her, while his mentor Obi-Wan Kenobi investigates the attempt on her life, leading him to uncover a clone army in service of the Republic. Soon, the trio witness the onset of a new threat to the galaxy: the Clone Wars. @ Development of Attack of the Clones began in March 2000, some months after the release of The Phantom Menace. By June 2000, Lucas and Hales completed a draft of the script, and principal photography took place from June to September 2000. The film crew primarily shot at Fox Studios Australia in Sydney, Australia, with additional footage filmed in Tunisia, Spain, and Italy. It was one of the first motion pictures shot completely on a high-definition digital 24-frame system. @ The film was released in the United States on May 16, 2002. It received mixed reviews, with some critics hailing it as an improvement over its predecessor The Phantom Menace and others considering it the worst installment of the franchise. The film was praised for an increased emphasis on action, visual effects, musical score, and costume design, but criticized for the screenplay, Christensens performance, romantic scenes, and underdeveloped characters. It performed well in the box office, making over $653 million worldwide; however, it also became the first Star Wars film to be outgrossed in its year of release, placing third domestically and fourth-highest-grossing worldwide. The third and final film of the prequel trilogy, Revenge of the Sith, was released in 2005.	2002-05-16	74	George Lucas	action film#adventure film#fantasy film#science fiction film
http://www.wikidata.org/entity/Q184768	https://en.wikipedia.org/wiki/The_Godfather_Part_II	The Godfather Part II	The Godfather Part II is a 1974 American epic crime film produced and directed by Francis Ford Coppola from the screenplay co-written with Mario Puzo, starring Al Pacino, Robert Duvall, Diane Keaton, Robert De Niro, Talia Shire, Morgana King, John Cazale, Mariana Hill, and Lee Strasberg. It is the second installment in The Godfather trilogy. Partially based on Puzos 1969 novel The Godfather, the film is both a sequel and a prequel to The Godfather, presenting parallel dramas: one picks up the 1958 story of Michael Corleone, the new Don of the Corleone family, protecting the family business in the aftermath of an attempt on his life; the prequel covers the journey of his father, Vito Corleone, from his Sicilian childhood to the founding of his family enterprise in New York City. @ Following the success of the first film, Paramount Pictures began developing a follow-up to the film, with much of the same cast and crew returning. Coppola, who was given more creative control over the film, had wanted to make both a sequel and a prequel to the film that would tell the story of the rise of Vito and the fall of Michael. Principal photography began in October 1973 and wrapped up in June 1974. The Godfather Part II premiered in New York City on December 12, 1974, and was released in the United States on December 20, 1974, receiving divided reviews from critics but its reputation, however, improved rapidly and it soon became the subject of critical re-evaluation. It grossed between $48–88 million worldwide on a $13 million budget. The film was nominated for eleven Academy Awards at the 47th Academy Awards and became the first sequel to win for Best Picture. Its six Oscar wins also included Best Director for Coppola, Best Supporting Actor for De Niro and Best Adapted Screenplay for Coppola and Puzo. Pacino won the BAFTA Award for Best Actor and was nominated for the Academy Award for Best Actor. @ Some have deemed it superior to The Godfather. Both Part II and its predecessor remain highly influential films, especially in the gangster genre, and are considered to be among the greatest films of all time. In 1997, the American Film Institute ranked it as the 32nd-greatest film in American film history and it retained this position 10 years later. It was selected for preservation in the U.S. National Film Registry of the Library of Congress in 1993, being deemed culturally, historically, or aesthetically significant. The Godfather Part III, the final installment in the trilogy, was released in 1990.	1974-12-12	74	Francis Ford Coppola	crime film#drama (film and television)#film based on a novel#flashback film
http://www.wikidata.org/entity/Q164963	https://en.wikipedia.org/wiki/The_Lord_of_the_Rings:_The_Two_Towers	The Lord of the Rings: The Two Towers	The Lord of the Rings: The Two Towers is a 2002 epic fantasy adventure film directed by Peter Jackson, based on the second volume of J. R. R. Tolkiens The Lord of the Rings. The film is the second instalment in The Lord of the Rings trilogy and was produced by Barrie M. Osborne, Fran Walsh and Jackson, and written by Walsh, Philippa Boyens, Stephen Sinclair and Jackson. The film features an ensemble cast including Elijah Wood, Ian McKellen, Liv Tyler, Viggo Mortensen, Sean Astin, Cate Blanchett, John Rhys-Davies, Bernard Hill, Christopher Lee, Billy Boyd, Dominic Monaghan, Orlando Bloom, Hugo Weaving, Miranda Otto, David Wenham, Brad Dourif, Karl Urban and Andy Serkis. It was preceded by The Fellowship of the Ring and followed by The Return of the King. @ Continuing the plot of The Fellowship of the Ring, the film intercuts three storylines. Frodo and Sam continue their journey towards Mordor to destroy the One Ring, meeting and joined by Gollum, the rings former owner. Aragorn, Legolas, and Gimli come to the war-torn nation of Rohan and are reunited with the resurrected Gandalf, before fighting against the legions of the treacherous wizard Saruman at the Battle of Helms Deep. Merry and Pippin escape capture, meet Treebeard the Ent, and help to plan an attack on Isengard, fortress of Saruman. @ The Two Towers was financed and distributed by American studio New Line Cinema, but filmed and edited entirely in Jacksons native New Zealand, concurrently with the other two parts of the trilogy. It premiered on 5 December 2002 at the Ziegfeld Theatre in New York City and was theatrically released on 18 December 2002 in the United States, and on 19 December 2002 in New Zealand. The film was highly acclaimed by critics and fans alike, who considered it to be a landmark in filmmaking and an achievement in the fantasy film genre. It grossed $951.2 million worldwide, making it the highest-grossing film of 2002 and the third highest-grossing film of all time at the time of its release. @ The Two Towers is widely regarded as one of the greatest and most influential films ever made. The film received numerous accolades; at the 75th Academy Awards, it was nominated for six awards, including Best Picture, Best Art Direction, Best Film Editing and Best Sound Mixing, winning two: Best Sound Editing and Best Visual Effects.	2002-12-05	74	Peter Jackson	action film#drama (film and television)#fantasy film#film based on a novel
http://www.wikidata.org/entity/Q484048	https://en.wikipedia.org/wiki/Am%C3%A9lie	Amélie	Amélie is a 2001 romantic comedy film directed by Jean-Pierre Jeunet. Written by Jeunet with Guillaume Laurant, the film is a whimsical depiction of contemporary Parisian life, set in Montmartre. It tells the story of a shy waitress, played by Audrey Tautou, who decides to change the lives of those around her for the better while struggling with her own isolation. The film also features an ensemble cast of supporting roles, including Mathieu Kassovitz, Rufus, Lorella Cravotta, Serge Merlin, Jamel Debbouze, Claire Maurier, Clotilde Mollet, Isabelle Nanty, Dominique Pinon, Artus de Penguern, Yolande Moreau, Urbain Cancelier, and Maurice Bénichou. @ The film was theatrically released in France on 25 April 2001 by UGC-Fox Distribution and in Germany on 16 August 2001 by Prokino Filmverleih. The film received critical acclaim, with praise for Tautous performance, the cinematography, production design, and writing. Amélie won Best Film at the European Film Awards; it also won four César Awards, including Best Film and Best Director). It won two British Academy Film Awards, including Best Original Screenplay, and was nominated for five Academy Awards, including Best Foreign Language Film and Best Original Screenplay. The film was a commercial success, grossing $174.2 million worldwide against a budget of $10 million. Taking in over $33 million in a limited theatrical release, it is to date the highest-grossing French-language film released in the United States, and one of the biggest international successes for a French film.	2001-01-01	73	Jean-Pierre Jeunet	comedy film#drama (film and television)#romantic comedy
http://www.wikidata.org/entity/Q25139	https://en.wikipedia.org/wiki/American_Beauty_(1999_film)	American Beauty	American Beauty is a 1999 American black comedy-drama film written by Alan Ball and directed by Sam Mendes. Kevin Spacey stars as Lester Burnham, an advertising executive who has a midlife crisis when he becomes infatuated with his teenage daughters best friend, played by Mena Suvari. Annette Bening stars as Lesters materialistic wife, Carolyn, and Thora Birch plays their insecure daughter, Jane. Wes Bentley, Chris Cooper, and Allison Janney also feature. Academics have described the film as a satire of American middle-class notions of beauty and personal satisfaction; further analysis has focused on the films explorations of romantic and paternal love, sexuality, materialism, self-liberation, and redemption. @ Ball began writing American Beauty as a play in the early 1990s, partly inspired by the media circus that accompanied the Amy Fisher trial in 1992. He shelved the play after deciding that the story would not work on stage. After several years as a television screenwriter, Ball revived the idea in 1997 when attempting to break into the film industry. The rewritten script had a cynical outlook influenced by Balls frustrating tenures writing for several sitcoms. Producers Dan Jinks and Bruce Cohen took the script for American Beauty to the fledgling DreamWorks studio, which bought it for $250,000, outbidding several other production bodies. DreamWorks financed the $15 million production and served as its North American distributor. American Beauty marked acclaimed theater director Mendes film debut; courted after his successful productions of the musicals Oliver! and Cabaret, Mendes was nevertheless only given the job after twenty others were considered and several A-list directors reportedly turned down the opportunity. @ Spacey was Mendes first choice for the role of Lester, though DreamWorks urged him to consider better-known actors. Similarly, the studio suggested several actresses for the role of Carolyn until Mendes offered the part to Bening without the studios knowledge. Principal photography took place between December 1998 and February 1999 on sound stages at the Warner Bros. backlot in Burbank, California and on location in Los Angeles. Mendes dominant directorial style was deliberate and composed; he made extensive use of static shots and slow pans and zooms to generate tension. Cinematographer Conrad Hall complemented Mendes style with peaceful shot compositions to contrast with the turbulent on-screen events. During editing, Mendes made several changes that softened the cynical tone of Balls script. @ Released in North America on September 17, 1999, American Beauty was acclaimed by critics and audiences; it was the best-reviewed American film of the year and grossed over $350 million worldwide. Reviewers praised most aspects of the production, with particular emphasis on Mendes, Spacey and Ball; criticism tended to focus on the familiarity of the characters and setting. DreamWorks launched a major campaign to increase American Beautys chances of Oscar success; at the 2000 ceremony the film won Best Picture, Best Director, Best Actor, Best Original Screenplay, and Best Cinematography. The film was nominated for and won many other awards and honors, mainly for directing, writing and acting.	1999-09-08	73	Sam Mendes	comedy-drama#drama (film and television)#flashback film#LGBT-related film#romantic comedy
