wikidata	wikipedia	film	abstract	date	sitelinks	director	genre
http://www.wikidata.org/entity/Q180214	https://en.wikipedia.org/wiki/Black_Swan_(film)	Black Swan	Black Swan is a 2010 American psychological horror film directed by Darren Aronofsky. The screenplay was written by Mark Heyman, John McLaughlin, and Andres Heinz, based on an original story by Heinz. The film stars Natalie Portman, Vincent Cassel, Mila Kunis, Barbara Hershey, and Winona Ryder. The plot revolves around a production of Tchaikovskys Swan Lake ballet by the New York City Ballet company. The production requires a ballerina to play the innocent and fragile White Swan, for which the committed dancer Nina is a perfect fit, as well as the dark and sensual Black Swan, which are qualities better embodied by the new rival Lily. Nina is overwhelmed by a feeling of immense pressure when she finds herself competing for the part, causing her to lose her tenuous grip on reality and descend into madness. @ Aronofsky conceived the premise by connecting his viewings of a production of Swan Lake with an unrealized screenplay about understudies and the notion of being haunted by a double, similar to the folklore surrounding doppelgängers. Aronofsky cites Fyodor Dostoevskys The Double as another inspiration for the film. The director also considered Black Swan a companion piece to his 2008 film The Wrestler, with both films involving demanding performances for different kinds of art. He and Portman first discussed the project in 2000, and after a brief attachment to Universal Studios, Black Swan was produced in New York City in 2009 by Fox Searchlight Pictures. Portman and Kunis trained in ballet for several months before filming began. @ Black Swan premiered as the opening film for the 67th Venice International Film Festival on September 1, 2010. It had a limited release in the United States starting December 3, 2010 and opened in wide release on December 17. Upon release, it received critical acclaim with particular praise toward Aronofskys direction and the performances of Kunis and Portman; it was also a commercial success, grossing $330 million worldwide against a $13 million budget. It received five nominations at the 83rd Academy Awards: Best Picture, Best Director, Best Cinematography, Best Film Editing and winning Best Actress for Portman, and received five nominations at the 68th Golden Globe Awards: Best Motion Picture, Best Director, Best Supporting Actress for Kunis and winning Best Actress for Portman.	2010-09-01	68	Darren Aronofsky	drama (film and television)#horror film#LGBT-related film#psychological horror#psychological thriller#thriller film
http://www.wikidata.org/entity/Q275120	https://en.wikipedia.org/wiki/Captain_America:_The_First_Avenger	Captain America: The First Avenger	Captain America: The First Avenger is a 2011 American superhero film based on the Marvel Comics character Captain America. Produced by Marvel Studios and distributed by Paramount Pictures, it is the fifth film in the Marvel Cinematic Universe. The film was directed by Joe Johnston, written by Christopher Markus and Stephen McFeely, and stars Chris Evans as Steve Rogers / Captain America alongside Tommy Lee Jones, Hugo Weaving, Hayley Atwell, Sebastian Stan, Dominic Cooper, Neal McDonough, Derek Luke, and Stanley Tucci. During World War II, Steve Rogers, a frail man, is transformed into the super-soldier Captain America and must stop the Red Skull from using the Tesseract as an energy source for world domination. @ The film began as a concept in 1997 and was scheduled for distribution by Artisan Entertainment. However, a lawsuit disrupted the project and was not settled until September 2003. In 2005, Marvel Studios received a loan from Merrill Lynch, and planned to finance and release the film through Paramount Pictures. Directors Jon Favreau and Louis Leterrier were interested in directing the project before Johnston was approached in 2008. The principal characters were cast between March and June 2010. Production began in June, and filming took place in London, Manchester, Caerwent, Liverpool, and Los Angeles. Several different techniques were used by the visual effects company Lola to create the physical appearance of the character before he becomes Captain America. @ Captain America: The First Avenger premiered at the El Capitan Theatre on July 19, 2011, and was released in the United States on July 22, as part of Phase One of the MCU. The film was commercially successful, grossing over $370 million worldwide. Critics particularly praised Evans performance, the films depiction of its 1940s time period, and Johnstons direction. Two sequels have been released: The Winter Soldier and Civil War.	2011-07-22	68	Joe Johnston	action film#science fiction film#superhero film#war film
http://www.wikidata.org/entity/Q571032	https://en.wikipedia.org/wiki/Django_Unchained	Django Unchained	Django Unchained is a 2012 American revisionist Western film written and directed by Quentin Tarantino, starring Jamie Foxx, Christoph Waltz, Leonardo DiCaprio, Kerry Washington, and Samuel L. Jackson, with Walton Goggins, Dennis Christopher, James Remar, Michael Parks, and Don Johnson in supporting roles. Set in the Old West and Antebellum South, it is a highly-stylized, heavily-revisionist tribute to Spaghetti Westerns, in particular the 1966 Italian film Django by Sergio Corbucci, whose star Franco Nero has a cameo appearance. @ Development of Django Unchained began in 2007 when Tarantino was writing a book on Corbucci. By April 2011, Tarantino sent his final draft of the script to The Weinstein Company. Casting began in the summer of 2011, with Michael K. Williams and Will Smith being considered for the role of the title character before Foxx was cast. Principal photography took place from November 2011 to March 2012 in California, Wyoming, and Louisiana. @ Django Unchained premiered at the Ziegfeld Theatre in New York City on December 11, 2012, and was theatrically released on December 25, 2012, in the United States, grossing over $425 million worldwide against its $100 million budget, becoming Tarantinos highest-grossing movie to date. The film received numerous awards and nominations, as well as five nominations at the 85th Academy Awards, including Best Picture. Waltz won several awards for his performance, among them Best Supporting Actor at the Academy Awards, Golden Globes and BAFTAs. For his screenplay, Tarantino won an Academy Award, a Golden Globe, and a BAFTA.	2012-12-25	68	Quentin Tarantino	blaxploitation#drama (film and television)#Western film
http://www.wikidata.org/entity/Q232009	https://en.wikipedia.org/wiki/Harry_Potter_and_the_Deathly_Hallows_%E2%80%93_Part_2	Harry Potter and the Deathly Hallows – Part 2	Harry Potter and the Deathly Hallows – Part 2 is a 2011 fantasy film directed by David Yates and distributed by Warner Bros. Pictures. It is the second of two cinematic parts based on J. K. Rowlings 2007 novel of the same name and the eighth and final instalment in the Harry Potter film series. It was written by Steve Kloves and produced by David Heyman, David Barron, and Rowling. The story continues to follow Harry Potters quest to find and destroy Lord Voldemorts Horcruxes in order to stop him once and for all. The film stars Daniel Radcliffe as Harry Potter, alongside Rupert Grint and Emma Watson as Harrys best friends, Ron Weasley and Hermione Granger. Principal photography began on 19 February 2009, and was completed on 12 June 2010, with reshoots taking place in December 2010. @ Part 2 was released in 2D, 3-D and IMAX cinemas worldwide from 13–15 July 2011, and is the only Harry Potter film to be released in 3-D. The film became a commercial success and one of the best reviewed films of 2011, with praise for the acting, Yatess direction, musical score, visual effects, cinematography, action sequences, and the satisfying conclusion of the saga. At the box office, Part 2 claimed the worldwide opening weekend record, earning $483.2 million, as well as setting opening day and opening weekend records in various countries. Part 2 grossed over $1.3 billion worldwide and became the third-highest-grossing film at the time, as well as the highest-grossing film of 2011. As of 2020, it is the 13th-highest-grossing film of all time, the highest-grossing film in the Harry Potter series, as well as in the Wizarding World franchise, and the ninth film to gross over $1 billion. It is also the highest-grossing film ever released by Warner Bros. The film won several awards and was nominated for many more, including three nominations at the Academy Awards for Best Art Direction, Best Makeup and Best Visual Effects. @ The Blu-ray and DVD sets were released on 11 November 2011 in the United States and on 2 December 2011 in the United Kingdom. The film was also released in the Harry Potter: Complete 8-Film Collection box set on DVD and Blu-ray, which included all eight films and new special features. Part 1 and Part 2 were released as a combo pack on DVD and Blu-ray on 11 November 2011 in Canada.	2011-07-13	68	David Yates	fantasy film#film based on a novel
http://www.wikidata.org/entity/Q205028	https://en.wikipedia.org/wiki/Iron_Man_2	Iron Man 2	Iron Man 2 is a 2010 American superhero film based on the Marvel Comics character Iron Man. Produced by Marvel Studios and distributed by Paramount Pictures, it is the sequel to Iron Man and the third film in the Marvel Cinematic Universe. Directed by Jon Favreau and written by Justin Theroux, the film stars Robert Downey Jr. as Tony Stark / Iron Man alongside Gwyneth Paltrow, Don Cheadle, Scarlett Johansson, Sam Rockwell, Mickey Rourke, and Samuel L. Jackson. Six months after Iron Man, Tony Stark resists calls from the United States government to hand over the Iron Man technology, which is causing his declining health. Meanwhile, Russian scientist Ivan Vanko uses his own version of the technology to pursue a vendetta against the Stark family. @ Following the critical and commercial success of Iron Man in May 2008, Marvel Studios announced and immediately set to work on producing a sequel. In July, Theroux was hired to write the script and Favreau was signed to return as director. Downey, Paltrow, and Jackson were set to reprise their roles from Iron Man, while Cheadle was brought in to replace Terrence Howard in the role of James Rhodes. In the early months of 2009, Rourke, Rockwell, and Johansson filled out the supporting cast. Filming took place from April to July 2009, mostly in California like the first film except for a key sequence in Monaco. Unlike its predecessor, which mixed digital and practical effects, the sequel primarily relied on computer-generated imagery to create the Iron Man suits. @ Iron Man 2 premiered at the El Capitan Theatre on April 26, 2010, and was released in the United States on May 7, as part of Phase One of the MCU. The film received generally positive reviews for Downeys performance as well as the action sequences, musical score, and visual effects, but many critics deemed it to be inferior to the first film and criticized the villain and pacing. The sequel grossed over $623.9 million at the worldwide box office, making it the seventh-highest-grossing film of 2010. It received an Academy Award nomination for Best Visual Effects. A third installment of the series, Iron Man 3, was released on May 3, 2013.	2010-04-29	68	Jon Favreau	action film#adventure film#science fiction film#superhero film
http://www.wikidata.org/entity/Q61448040	https://en.wikipedia.org/wiki/Parasite_(2019_film)	Parasite	Parasite is a 2019 South Korean black comedy thriller film directed by Bong Joon-ho, who also co-wrote the screenplay with Han Jin-won. It stars Song Kang-ho, Lee Sun-kyun, Cho Yeo-jeong, Choi Woo-shik, Park So-dam, Jang Hye-jin, and Lee Jung-eun, and follows the members of a poor family who scheme to become employed by a wealthy family and infiltrate their household by posing as unrelated, highly qualified individuals. @ Parasite premiered at the 2019 Cannes Film Festival on 21 May 2019, where it became the first South Korean film to win the Palme dOr. It was then released in South Korea by CJ Entertainment on 30 May 2019. The film was considered by many critics to be the best film of 2019 as well as one of the best films of the decade, and is the 46th highest-rated film of all-time on Metacritic. It grossed over $258 million worldwide on a production budget of about $11 million, becoming the highest-grossing South Korean film. @ Among its numerous accolades, Parasite won a leading four awards at the 92nd Academy Awards: Best Picture, Best Director, Best Original Screenplay, and Best International Feature Film, becoming the first non-English language film to win the Academy Award for Best Picture. @ It was also the first South Korean film to receive Academy Award recognition, and one of three films to win both the Palme dOr and the Academy Award for Best Picture. It also won the Golden Globe Award for Best Foreign Language Film and the BAFTA Award for Best Film Not in the English Language, and became the first non-English film to win the Screen Actors Guild Award for Outstanding Performance by a Cast in a Motion Picture. At the 56th Grand Bell Awards, Parasite earned a leading eleven nominations with five wins.	2019-05-21	68	Bong Joon-ho	black comedy#comedy film#drama (film and television)#thriller film
http://www.wikidata.org/entity/Q174284	https://en.wikipedia.org/wiki/Raiders_of_the_Lost_Ark	Raiders of the Lost Ark	Raiders of the Lost Ark is a 1981 American action-adventure film directed by Steven Spielberg and written by Lawrence Kasdan based on a story by George Lucas and Philip Kaufman. It stars Harrison Ford, Karen Allen, Paul Freeman, Ronald Lacey, John Rhys-Davies and Denholm Elliott. Ford portrays Indiana Jones, a globe-trotting archaeologist, vying with Nazi forces in 1936, to recover the long-lost Ark of the Covenant, a relic said to make an army invincible. Teaming up with his tough former lover Marion Ravenwood, Jones races to stop rival archaeologist Dr. René Belloq from guiding the Nazis to the Ark and its power. @ Lucas conceived Raiders of the Lost Ark in the early 1970s. Seeking to modernize the serial films of the early 20th-century, he developed the idea further with Kaufman, who suggested the Ark as the films goal. Lucas eventually focused on developing his 1977 space opera Star Wars. Development on Raiders of the Lost Ark resumed that year when Lucas shared the idea with Spielberg; he joined the project several months later. While the pair had ideas for significant scenes in the film, they hired Kasdan to fill in the gaps between them. Principal photography began in June 1980 on a $20million budget. Filming took place on sets at Elstree Studios, England, and on location in La Rochelle, Tunisia, Hawaii and California. @ Though pre-release polling showed little audience interest in the film, especially compared to the superhero film Superman II, Raiders of the Lost Ark became the highest-grossing film of 1981, earning approximately $330.5million worldwide. It played in some theaters for over a year because of its popularity. It was a critical success, receiving praise for its modern take on older serial films, and its non-stop action and adventure. The cast were all praised, particularly Ford, Allen and Freeman. Raiders of the Lost Ark received numerous award nominations and, among others, won five Academy Awards, seven Saturn Awards, and one BAFTA award. @ In the years since its release, the film has grown in esteem, and many now consider it to be among the greatest films of all time, one of the greatest films of the 1980s, and one of the greatest action-adventure films ever made. It had a significant impact on popular culture; the films success spawned a host of imitators across several media and inspired a variety of filmmakers. It continues to influence modern media. Raiders of the Lost Ark is the first film in what would become the Indiana Jones franchise, that includes three film sequels—Indiana Jones and the Temple of Doom, Indiana Jones and the Last Crusade, and Indiana Jones and the Kingdom of the Crystal Skull—a television series, video games, comic books, novels, theme park attractions, toys, board games, collectibles and an amateur remake. The United States Library of Congress deemed culturally, historically, or aesthetically significant when they selected it for preservation in the National Film Registry in 1999.	1981-06-12	68	Steven Spielberg	action film#treasure hunt film
http://www.wikidata.org/entity/Q212965	https://en.wikipedia.org/wiki/The_Hunger_Games_(film)	The Hunger Games	The Hunger Games is a 2012 American dystopian science fiction action film directed by Gary Ross and based on Suzanne Collinss 2008 novel of the same name. It is the first installment in The Hunger Games film series and was produced by Nina Jacobson and Jon Kilik, with a screenplay by Ross, Collins, and Billy Ray. The film stars Jennifer Lawrence, Josh Hutcherson, Liam Hemsworth, Woody Harrelson, Elizabeth Banks, Lenny Kravitz, Stanley Tucci, and Donald Sutherland. Set in a dystopian post-apocalyptic future in the nation of Panem, where a boy and a girl from each of the nations 12 Districts are chosen annually as tributes and forced to compete in The Hunger Games, an elaborate televised fight to the death, Katniss Everdeen volunteers to take her younger sisters place. With her districts male tribute, Peeta Mellark, Katniss travels to the Capitol to train and compete in the games. @ Development of The Hunger Games began in March 2009 when Lions Gate Entertainment entered into a co-production agreement with Color Force, which had acquired the rights a few weeks earlier. Collins collaborated with Ray and Ross to write the screenplay. The screenplay expanded the character of Seneca Crane to allow several developments to be shown directly to the audience and Ross added several scenes between Crane and Coriolanus Snow. The main characters were cast between March and May 2011. Principal photography began in May 2011 and ended in September 2011, with filming taking place in North Carolina. @ The film was released on March 21, 2012, in some European countries and in the US and UK on March 23, 2012, in both conventional theaters and digital IMAX theaters. Japan received it last, on September 28. When the film was released, it set records for opening day and opening weekend for a non-sequel. At the time of its release, the films opening weekend gross was the third-largest of any film in North America. It is the first film since Avatar to remain in first place at the North American box office for four consecutive weekends. The film was a massive box-office success by grossing over $694 million worldwide against its budget of $78 million, making it the third-highest-grossing film in the United States and ninth-highest-grossing film of 2012. It was released on DVD and Blu-ray on August 18, 2012. With 7,434,058 units sold, the DVD was the best-selling DVD of 2012. The second installment, Catching Fire, was released on November 22, 2013, in the United States. @ The Hunger Games received positive reviews from critics, with praise for its themes and messages, as well as Jennifer Lawrences portrayal of Katniss; some criticism was levelled at the films reliance on shaky cam, especially in the action sequences, and its similarities to other works. The films soundtrack featured the song Safe & Sound, which was sung by American singer Taylor Swift featuring The Civil Wars; it won a Grammy Award and was nominated for a Golden Globe Award for Best Original Song. For her performance, Lawrence won the Saturn Award for Best Actress, the Broadcast Film Critics Association Award for Best Actress in an Action Movie, the Empire Award for Best Actress and was also nominated for the New York Film Critics Circle Award for Best Actress.	2012-03-21	68	Gary Ross	action film#adventure film#drama (film and television)#dystopian film#fantasy film#film based on a novel#post-apocalyptic film#psychological thriller#science fiction film
http://www.wikidata.org/entity/Q190956	https://en.wikipedia.org/wiki/Amadeus_(film)	Amadeus	Amadeus is a 1984 American period biographical drama film directed by Miloš Forman and adapted by Peter Shaffer from his 1979 stage play Amadeus. The story is set in Vienna, Austria during the latter half of the 18th century, and is a fictionalized story of Wolfgang Amadeus Mozart from the time he left Salzburg, described by its writer as fantasia on the theme of Mozart and Salieri. Mozarts music is heard extensively in the soundtrack of the film. The film follows a fictional rivalry between Mozart and Italian composer Antonio Salieri at the court of Emperor Joseph II. The film stars F. Murray Abraham as Salieri and Tom Hulce as Mozart. @ Amadeus was released by Orion Pictures on September 19, 1984, thirteen days following its world premiere in Los Angeles on September 6, 1984. Upon release, the film received widespread acclaim and was a box office hit by grossing over $90 million. @ Considered one of the greatest films of all time, Amadeus was nominated for 53 awards and received 40, including eight Academy Awards, four BAFTA Awards, four Golden Globe Awards, and a Directors Guild of America award. , it is the most recent film to have more than one nomination in the Academy Award for Best Actor category. In 1998, the American Film Institute ranked it 53rd on its 100 Years... 100 Movies list. In 2019, the film was selected for preservation in the United States National Film Registry by the Library of Congress as being culturally, historically, or aesthetically significant.	1984-01-01	67	Miloš Forman	biographical film#costume drama#drama (film and television)#flashback film#musical film
http://www.wikidata.org/entity/Q151904	https://en.wikipedia.org/wiki/Casino_Royale_(2006_film)	Casino Royale	Casino Royale is a 2006 spy film, the twenty-first in the Eon Productions James Bond series, and the third screen adaptation of Ian Flemings 1953 novel of the same name. Directed by Martin Campbell and written by Neil Purvis, Robert Wade and Paul Haggis, it is the first film to star Daniel Craig as the fictional MI6 agent James Bond, and was produced by Eon Productions for Metro-Goldwyn-Mayer and Columbia Pictures, making it the first Eon-produced Bond film to be co-produced by Columbia. Following Die Another Day, Eon Productions decided to reboot the series, allowing them to show a less experienced and more vulnerable Bond. @ Casino Royale takes place at the beginning of Bonds career as Agent 007, as he is earning his licence to kill. The plot has Bond on an assignment to bankrupt terrorist financier Le Chiffre in a high-stakes poker game at the Casino Royale in Montenegro; Bond falls in love with Vesper Lynd, a treasury employee assigned to provide the money he needs for the game. The film begins a story arc that continues in the 2008 film, Quantum of Solace. @ Casting involved a widespread search for a new actor to succeed Pierce Brosnan as James Bond; the choice of Craig, announced in October 2005, drew controversy. Location filming took place in the Czech Republic, the Bahamas, Italy, and the United Kingdom with interior sets built at Barrandov Studios and Pinewood Studios. @ Casino Royale premiered at the Odeon Leicester Square on 14 November 2006. It received an overwhelmingly positive critical response, with reviewers highlighting Craigs reinvention of the character and the films departure from the tropes of previous Bond films. It earned $ worldwide, becoming the highest-grossing James Bond film until the release of Skyfall in 2012.	2006-11-14	67	Martin Campbell	action film#film based on a novel#spy film
